{
  "$schema": "https://json-schema.org/draft/2020-12/schema",
  "$id": "https://nvbes.local/migration/live-evidence.schema.json",
  "title": "nvbes live migration evidence",
  "type": "object",
  "additionalProperties": false,
  "required": [
    "schema_version",
    "evidence_id",
    "evidence_type",
    "environment",
    "captured_at",
    "owner",
    "source_artifact",
    "command",
    "result",
    "decision",
    "immutable_reference",
    "packet_requirement",
    "checksums"
  ],
  "properties": {
    "schema_version": {
      "type": "integer",
      "const": 1
    },
    "evidence_id": {
      "type": "string",
      "minLength": 8,
      "pattern": "^[a-z0-9][a-z0-9.-]{6,126}[a-z0-9]$"
    },
    "evidence_type": {
      "type": "string",
      "enum": [
        "frontend_signoff",
        "web_check",
        "smoke_test",
        "infra_restore",
        "infra_deploy",
        "rehearsal",
        "rollback",
        "reject_review",
        "cutover",
        "reconciliation",
        "decommission"
      ]
    },
    "environment": {
      "type": "string",
      "enum": [
        "local",
        "staging",
        "production"
      ]
    },
    "captured_at": {
      "type": "string",
      "format": "date-time"
    },
    "owner": {
      "type": "string",
      "minLength": 3
    },
    "source_artifact": {
      "type": "string",
      "minLength": 3
    },
    "command": {
      "type": "string",
      "minLength": 3
    },
    "result": {
      "type": "string",
      "enum": [
        "passed",
        "accepted",
        "failed",
        "blocking"
      ]
    },
    "decision": {
      "type": "string",
      "enum": [
        "go",
        "no-go"
      ]
    },
    "immutable_reference": {
      "type": "string",
      "minLength": 8
    },
    "packet_requirement": {
      "type": "string",
      "enum": [
        "g4-frontend-signoff",
        "g5-infra-signoff",
        "p11-rehearsals",
        "p12-cutover",
        "p13-decommission",
        "final-reconciliation"
      ]
    },
    "checksums": {
      "type": "array",
      "minItems": 1,
      "maxItems": 4,
      "items": {
        "type": "object",
        "additionalProperties": false,
        "required": [
          "name",
          "algorithm",
          "value"
        ],
        "properties": {
          "name": {
            "type": "string",
            "minLength": 1
          },
          "algorithm": {
            "type": "string",
            "enum": [
              "sha256",
              "sha512"
            ]
          },
          "value": {
            "type": "string",
            "minLength": 32,
            "pattern": "^[a-fA-F0-9]+$"
          }
        }
      }
    },
    "notes": {
      "type": "string"
    }
  }
}
