{
  "schema_version": 1,
  "evidence_id": "template-live-evidence",
  "evidence_type": "reconciliation",
  "environment": "staging",
  "captured_at": "1970-01-01T00:00:00.000Z",
  "owner": "migration lead required",
  "source_artifact": "docs/migration/reconciliation.<run>.json",
  "command": "node tools/migration/reconcile.mjs --env staging --report docs/migration/reconciliation.<run>.json",
  "result": "blocking",
  "decision": "no-go",
  "immutable_reference": "replace-with-ci-or-artifact-uri",
  "packet_requirement": "final-reconciliation",
  "checksums": [
    {
      "name": "source_artifact",
      "algorithm": "sha256",
      "value": "0000000000000000000000000000000000000000000000000000000000000000"
    },
    {
      "name": "cutover_evidence_packet",
      "algorithm": "sha256",
      "value": "0000000000000000000000000000000000000000000000000000000000000000"
    }
  ],
  "notes": "Template only. Prefer tools/migration/live-evidence-prepare.mjs after a real run. For local source_artifact paths, the checksum value must match the file digest. The cutover_evidence_packet checksum must match docs/migration/cutover-evidence-packet.generated.json."
}
